Date,ticker_x,true_sentiment,title,author,url,source,text,finbert_sentiment,finbert_sent_score,Volume,country,manufacturing pmi,services pmi,consumer confidence,interest rates,cpi yoy,core cpi,unemployment rate,gdp yoy,ticker_y,open,high,low,close,CPIAUCSL_PC1,PPIACO,PCE,GDP,SOFR,UNRATE,Close,High,Low,Open
2024-07-26,GBPUSD,Negative,GBPUSD Price Analysis Downside resumes as yields soar amid fears of bigger rates from Fed,Sagar Dua,https://www.fxstreet.com/news/gbp-usd-price-analysis-downside-resumes-as-yields-soar-amid-fears-of-bigger-rates-from-fed-202303080331,FX Street,"The GBP/USD pair has delivered a downside break of the consolidation formed around 1.1820 in the Asian session. The Cable has resumed its downside journey and has refreshed its day’s low at 1.1812. Rising fears of a recession in theUnited Stateshave propelled returns on US government bonds. The 10-year US Treasury yields have recaptured the 4.0% resistance. TheUS Dollar Index(DXY) has refreshed its three-month high above 105.80 as the Federal Reserve (Fed) chairJerome Powellhas confirmed that biggerratesare in pipeline to tame the stubborn inflation. Fed’s Powell is expecting a higher terminal rate than previously anticipated. Meanwhile, S&P500 futures have also resumed their downside journey, portraying that the risk-off mood is strengthening further. A breakdown from the range of 1.1914-1.2150 by the Cable is followed by a large consolidation breakdown formed in the past three months. The asset is expected to continue its downside move towards the horizontal support plotted from November 08 high around 1.1600. The 20-period Exponential Moving Average (EMA) at 1.1960 is expected to act as a major barricade for the Pound Sterling. Also, the Relative Strength Index (RSI) (14) has slipped into the bearish range of 20.00-40.00, which indicates that the downside momentum has been triggered. Shouldthe Cablebreak below the round-level support of 1.1800, US Dollar bulls will drag the asset further toward November 17 low at 1.17633 followed by November 14 low around 1.1700. On the flip side, a move above February 24 high at 1.2040 will drive the asset toward February 23 high around 1.2080. A breach of the latter will expose the asset to February 21 high around 1.2140. GBP/USD four-hour chart  GBP/USD  ",Negative,-0.72,141585.0,united states,47.4,50.5,69.7,0.055,0.034,0.039,0.037,0.031,dxy,103.36,104.26,100.62,101.33,2.93846,257.321,19866.3,29374.914,5.35,4.2,104.31999969482422,104.4499969482422,104.20999908447266,104.36000061035156
2024-07-29,EURUSD,Negative,EURUSD refreshes multiday low under 10550 as Fed’s Powell widens yield curve inversion ECB’s Lagarde eyed,Anil Panchal,https://www.fxstreet.com/news/eur-usd-refreshes-multi-day-low-under-10550-as-feds-powell-widens-yield-curve-inversion-ecbs-lagarde-eyed-202303080435,FX Street," EUR/USDrenews a two-month low near 1.0525 as it extends the previous day’s south-run amid the widest yield curve inversion since 1981. It’s worth noting that the Euro pair slumped the most in more than a month the previous day on Federal Reserve (Fed) Jerome Powell’s hawkish rhetoric but a lack of major data/events seem to probe the bears of late, despite keeping them in the driver’s seat during early Wednesday. On Tuesday, Fed Chair Powell surprised traders by showing readiness for more rate hikes and bolstered the bets of a 50 bps Fed rate hike in March during the Semi-Annual Testimony before the US Congress. The policymaker propelled the “higher for longer” Fed rate expectations and bolstered the US Treasury bond yields while weighing on theequities. His comments propelled the yields and the US Dollar. It’s worth noting that the policymakers at theEuropean Central Bank(ECB) tried to defend their hawkish stance during public appearances but could not save the EUR/USD from renewing a two-month low. That said, ECB policymaker and Spanish central bank head Pablo Hernandez de Cos said on Tuesday, “Spain’s GDP forecast is anticipated to be revised up, while CPI is expected to fall.” On a broader front, ECB policymaker Klaas Knot said on Tuesday that the ECB can be expected to keep raising interestratesfor “quite some time” after March. Elsewhere, the US removal of the testing restrictions on travelers from China contrasts with the likely escalation of the Sino-American tensions surrounding Taiwan and Russia to weigh on the sentiment, as well as propel the US Dollar’s haven demand. However, a light calendar in Asia and cautious mood ahead of the key EU and US data/events seem to probe the EUR/USD traders even as the sellers refreshed a multi-day low recently. Amid these plays, the S&P 500 Futures remain indecisive around the 3,988 level after falling the most in two weeks the previous day. On the other hand, the difference between the 10-year and two-year US bond coupons marked the deepest yield curve inversion in more than 40 years the previous day, keeping it intact by the press time. It should be observed that the US 10-year Treasury bond yields rose 0.15% while closing around 3.97% on Tuesday but the two-year counterpart gained 2.60% on a day when poking the highest levels since 2007, to 5.02% at the latest. Looking forward, German Retail Sales for January, the second readings of Gross Domestic Product (GDP) for the fourth quarter (Q4) and Employment Change for the said period will precede the US ADP Employment Change for February to decorate the calendar. Additionally important will be the speeches from ECB PresidentChristine Lagardeand the second round of Fed Chair Jerome Powell’s Testimony. Technical analysis A daily closing below the two-month-old ascending support line, now immediate hurdle near 1.0540, becomes necessary for the EUR/USD bears to aim for January’s low surrounding 1.0480. Additional important levels  ",Negative,-0.68,198917.0,united states,47.4,50.5,69.7,0.055,0.034,0.039,0.037,0.031,dxy,103.36,104.26,100.62,101.33,2.93846,257.321,19866.3,29374.914,5.33,4.2,104.55999755859376,104.75,104.13999938964844,104.33000183105467
2024-07-30,AUDUSD,Positive,AUDUSD Price Analysis Bounces off 13dayold support line to aim for 06600,Anil Panchal,https://www.fxstreet.com/news/aud-usd-price-analysis-bounces-off-13-day-old-support-line-to-aim-for-06600-202303080551,FX Street," AUD/USDrecovers from a four-month low surrounding 0.6565 as it approaches the 0.6600 threshold heading into Wednesday’s European session, poking 0.6595 by the press time. In doing so, the Aussie pair bounce off a two-week-old descending support line while paring the biggest daily loss since February 03. Not only the downward-sloping support line from February 17 but the oversold RSI (14) also puts a floor under the AUD/USD price. The recovery moves, however, remain elusive as the previous support line from February 06, close to 0.6625 at the latest, guards the pair’s nearby upside. Following that, the 50-SMA hurdle surrounding 0.6725 can challenge the AUD/USD buyers. It should be noted that the upside break of 0.6725 isn’t an open invitation to the AUD/USD bulls as the monthly high near 0.6775 appears the key hurdle. Meanwhile, a downside break of the aforementioned support line, close to 0.6565 at the latest, could drag the Aussie prices towards the 0.6540-20 support zone as multiple levels marked in October 2022 might challenge the bears afterward. In a case where the AUD/USD pair remains bearish past 0.6520, the odds of witnessing a slump toward the previous yearly low surrounding 0.6170 can’t be ruled out. AUD/USD: Four-hour chart  Trend: Limited recovery expected Additional important levels  ",Positive,0.19,170305.0,united states,47.4,50.5,69.7,0.055,0.034,0.039,0.037,0.031,dxy,103.36,104.26,100.62,101.33,2.93846,257.321,19866.3,29374.914,5.33,4.2,104.5500030517578,104.8000030517578,104.45999908447266,104.55999755859376
2024-07-31,EURUSD,Negative,EURUSD could slip back below 10500 – UOB,Pablo Piovano,https://www.fxstreet.com/news/eur-usd-could-slip-back-below-10500-uob-202303080700,FX Street,"In the view of UOB Group’s Economist Lee Sue Ann and Markets Strategist Quek Ser Leang, further weakness could dragEUR/USDback below the 1.0500 region in the near term. Key Quotes 24-hour view: “Our view for EUR to rise above 1.0700 was incorrect as it plunged to a low of 1.0544 in NY trade. While EUR could weaken further, any decline is unlikely to break the major support at 1.0485 today (there is another support at 1.0530). Any rebound is likely to stay below 1.0610 (minor resistance is at 1.0580).” Next 1-3 weeks: “Yesterday (07 Mar, spot at 1.0685), we highlighted that EUR appears poised to head higher towards 1.0750. We added, ‘On the downside, a breach of the ‘strong support’ level, currently at 1.0615, would indicate that the upside risk has faded’. Our view was invalidated quickly as EUR plunged to a low of 1.0544 in NY trade. Downward momentum has improved, albeit not much. From here, as long as EUR does not move above 1.0650 (‘strong resistance’) in the next few days, it is likely to gravitate lower towards 1.0485.”",Negative,-0.92,256291.0,united states,47.4,50.5,69.7,0.055,0.034,0.039,0.037,0.031,dxy,103.36,104.26,100.62,101.33,2.93846,257.321,19866.3,29374.914,5.38,4.2,104.0999984741211,104.52999877929688,103.93000030517578,104.43000030517578
2024-08-01,EURUSD,Negative,German Retail Sales plunge 69 YoY in January vs 61 expected,Dhwani Mehta,https://www.fxstreet.com/news/german-retail-sales-plunge-69-yoy-in-january-vs-61-expected-202303080701,FX Street,"According to the official figures released by Destatis on Tuesday, Germany'sRetail Salesdropped by 0.3% MoM in January versus 2.0% expected and -5.3% previous, On an annualized basis, the bloc’sRetail Salesslumped by another 6.9% in January versus the -6.1% expected and a 6.4% decline seen in December. FX implications The Eurois unperturbed by the terrible German data. At the time of writing, the EUR/USD pair trades at 1.0535, down 0.10% on the day. About German Retail Sales TheRetail Salesreleased by theStatistisches Bundesamt Deutschlandis a measure of changes in sales of the German retail sector. It shows the performance of the retail sector in the short term. Percent changes reflect the rate of changes of such sales. The changes are widely followed as an indicator of consumer spending. Positive economic growth is usually anticipated as ""bullish"" for the EUR, while a low reading is seen as negative, or bearish, for the EUR.",Negative,-0.96,263308.0,united states,47.4,50.5,69.7,0.055,0.034,0.039,0.037,0.031,dxy,103.36,104.26,100.62,101.33,2.61091,255.463,19905.0,29374.914,5.35,4.2,104.41999816894533,104.4499969482422,103.86000061035156,104.06999969482422
2024-08-02,EURUSD,Positive,German Industrial Production jumps 35 MoM in January vs 14 expected,Dhwani Mehta,https://www.fxstreet.com/news/german-industrial-production-jumps-35-mom-in-january-vs-14-expected-202303080703,FX Street,"Industrial Production in Germany continued its uptrend in January, the official data showed on Wednesday, suggesting that the manufacturing sector recovery is gaining traction. Eurozone’s economic powerhouse’s Industrial Output jumped by 3.5% MoM, the federal statistics authority Destatis said in figures adjusted for seasonal andcalendareffects, vs. a 1.4% expected and -2.4% prior. On an annualized basis, German Industrial Production arrived at -1.6% in January versus a -3.3% figure booked in December and -2.1% market expectations. FX implications The shared currency failed to draw inspiration from the upbeat German industrial figures, in the face of a slump in Retail Sales. At the time of writing,EUR/USDis trading at around 1.0635, losing 0.10% on the day. About German Industrial Production The Industrial Production released by the Statistisches Bundesamt Deutschland measures the outputs of German factories and mines. Changes in industrial production are widely followed as a major indicator of strength in the manufacturing sector. A high reading is seen as positive (or bullish) for the EUR, whereas a low reading is seen as negative (or bearish).",Positive,0.34,393414.0,united states,47.4,50.5,69.7,0.055,0.034,0.039,0.037,0.031,dxy,103.36,104.26,100.62,101.33,2.61091,255.463,19905.0,29374.914,5.35,4.2,103.20999908447266,104.43000030517578,103.12999725341795,104.30999755859376
2024-08-05,EURUSD,Negative,Forex Today Hawkish Powell lifts US Dollar to multimonth highs ahead of US data,Eren Sengezer,https://www.fxstreet.com/news/forex-today-hawkish-powell-lifts-us-dollar-to-multi-month-highs-ahead-of-us-data-202303080723,FX Street,"Here is what you need to know on Wednesday, March 8: While testifying before the US Senate on Tuesday, FOMC Chairman Jerome Powell opened the door wide open to a 50 basis points rate hike at the next meeting. Powell noted that they are prepared to increase the pace of rate hikes if data warranted it and triggered a rally in the US Dollar with theUS Dollar Index(DXY) reaching its highest level since early November near 106.00. Eurostat will release the Q4 Gross Domestic Product (GDP) revision in the European session ahead of February ADP Employment Change and January Goods Trade Balance data from the US. Powell will testify before House Financial Services Committee. ADP Jobs Preview: A sandwich between Powell and NFP. In response to Powell's hawkish rhetoric, Wall Street's main indexes suffered heavy losses on Tuesday and the benchmark 10-year US Treasury bond yield recovered to the 4% area. Early Wednesday US Stock index futures trade mixed while the DXY consolidates its gains at around 105.70. EUR/USDlost more than 100 pips on Tuesday and closed below 1.0550. The pair stays relatively quiet in the early European morning. The data from Germany showed that Industrial Production expanded by 3.5% on a monthly basis in January, surpassing the market expectation for an increase of 1.4%. On a negative note, Retail Sales contracted by 0.3% in the same period, coming in much worse than analysts' estimate for a growth of 2%.European Central Bank(ECB) President Christine Lagarde is scheduled to speak later in the session but she is not expected to touch on the policy or the economic outlook. GBP/USDbroke below 1.2000 with the initial reaction to Powell's statement and triggered a heavy technical selloff. The pair extended its slide toward 1.1800 in the second half of the day on Tuesday and touched its weakest level since late November. At the time of press, GBP/USD was fluctuating in a tight range at around 1.1820. Boosted by surging US Treasury bond yields and the renewed USD strength,USD/JPYclimbed to a new 2023-high above 138.00 in the Asian trading hours before retreating modestly. The data from Japan showed earlier in the day that the Leading Economic Index and the Coincident Index in January declined to 96.5 and 96.1, respectively. AUD/USDsuffered heavy losses on Tuesday as Powell's hawkish remarks highlighted the divergence between the Fed's and the Reserve Bank of Australia's policy outlooks. Although the pair managed to recover modestly in the Asian session, it was last seen trading at around its weakest level since November near 0.6600. Goldprice erased all the previous week's gains in a single day on Tuesday as it declined below $1,810 from $1,850. XAU/USD moves up and down in a narrow channel slightly above $1,810 in the European morning. USD/CADgathered bullish momentum and broke above 1.3700 on Tuesday following Monday's indecisive action. The Bank of Canada is forecast to keep its policy rate unchanged at 4.5% later in the day. Bank of Canada Preview: Canadian Dollar set to climb on hawkish hold, market positioning. Pressured by risk-aversion in the second half of the day,Bitcoinlost nearly 1% on Tuesday and continued to push lower early Wednesday. BTC/USD was last seen trading at $22,000, where it was down 0.9% on a daily basis.Ethereumalso registered modest losses on Tuesday. ETH/USD stays on the back foot in the European morning and trades in negative territory at around $1,550.",Positive,0.73,419359.0,united states,47.4,50.5,69.7,0.055,0.034,0.039,0.037,0.031,dxy,103.36,104.26,100.62,101.33,2.61091,255.463,19905.0,29374.914,5.32,4.2,102.69000244140624,103.27999877929688,102.16000366210938,103.22000122070312
2024-08-06,AUDUSD,Negative,AUDUSD risks further downside near term – UOB,Pablo Piovano,https://www.fxstreet.com/news/aud-usd-risks-further-downside-near-term-uob-202303080801,FX Street,"UOB Group’s Economist Lee Sue Ann and Markets Strategist Quek Ser Leang suggest further downside is likely inAUD/USDin the next few weeks. Key Quotes 24-hour view: “While we expected AUD to weaken yesterday, we were of the view that ‘any decline is expected to face solid support at 0.6695’. The anticipated support did not materialize as AUD nosedived to a low of 0.6580. The outsized decline appears to be overdone but AUD could drop to 0.6550 before stabilization is likely. The next support at 0.6500 is unlikely to come into view today. On the upside, any rebound is likely to stay below 0.6665 (minor resistance is at 0.6625).” Next 1-3 weeks: “We have expected AUD to consolidate between 0.6695 and 0.6820 since two days ago. Yesterday (07 Mar, spot at 0.6760), we highlighted that ‘Looking ahead, if AUD were to break and stay below 0.6695, it would suggest the weakness in AUD has resumed’. That said, we did not expect the outsized drop as AUD cracked several strong support levels and nosedived to a low of 0.6580. While the price actions suggest AUD is likely to weaken further, any weakness is likely to be at a slower pace, and the major support at 0.6500 may not come into view so soon. The downside risk is intact as long as AUD stays below 0.6700 (‘strong resistance’ level) in the next few days.”",Negative,-0.89,255466.0,united states,47.4,50.5,69.7,0.055,0.034,0.039,0.037,0.031,dxy,103.36,104.26,100.62,101.33,2.61091,255.463,19905.0,29374.914,5.33,4.2,102.97000122070312,103.2300033569336,102.6999969482422,102.77999877929688
2024-08-07,EURUSD,Negative,EURUSD is very limited on the upside – Commerzbank,FXStreet Insights Team,https://www.fxstreet.com/news/eur-usd-is-very-limited-on-the-upside-commerzbank-202303080810,FX Street,"In early FebruaryEUR/USDtraded at these 1.05 levels already. Ulrich Leuchtmann, Head of FX and Commodity Research, analyzes the pair’soutlook. 1.20 is totally unrealistic at present “Being a safe haven is an attractive characteristic. Because it is the Dollar that possesses this characteristic, rather than the Euro as used to be the case, that means that EUR/USD exchangeratesthat used to be obtainable are no longer realistic from my point of view. To be precise: 1.20 is totally unrealistic at present.” “Don’t get me wrong. 1.10 might be overly cautious, we can talk about that. And we reserve the right to adjust the EUR/USD target slightly to the upside, but as long as the described environment does not change fundamentally, I will stick to my view: the EUR/USD exchange rate is very limited on the upside.” ",Neutral,0.16,181866.0,united states,47.4,50.5,69.7,0.055,0.034,0.039,0.037,0.031,dxy,103.36,104.26,100.62,101.33,2.61091,255.463,19905.0,29374.914,5.33,4.2,103.1999969482422,103.37000274658205,102.91999816894533,102.9499969482422
2024-08-08,USDJPY,Positive,USDJPY The 13820 region now emerges on the horizon – UOB,Pablo Piovano,https://www.fxstreet.com/news/usd-jpy-the-13820-region-now-emerges-on-the-horizon-uob-202303080826,FX Street,"In opinion of UOB Group’s Economist Lee Sue Ann and Markets Strategist Quek Ser Leang,USD/JPYcould extend the upside momentum to the 138.20 zone in the near term. Key Quotes 24-hour view: “We expected USD to trade in a range yesterday. However, it lifted off and soared to 137.19 before extending its advance in early Asian trade. Strong momentum suggests USD is likely to rise further but the major resistance at 138.20 could be out of reach today. On the downside, any pullback is unlikely to threaten 136.50 (minor support is at 137.00).” Next 1-3 weeks: “Two days ago (06 Mar, spot at 135.90), we indicated that the recent USD strength has ended. We added, USD ‘appears to have moved into a consolidation phase and it is likely to trade within a range of 134.50/137.10 for now’. We did anticipate USD to resume its upward trajectory so quickly as it leapt to a high of 137.19 in NY trade before extending its advance in Asia trade today. The surge in momentum is expected to lead to further USD strength, likely towards 138.20. On the downside, a breach of 136.20 (‘strong support’ level) would indicate that USD is not strengthening further.",Neutral,0.45,187006.0,united states,47.4,50.5,69.7,0.055,0.034,0.039,0.037,0.031,dxy,103.36,104.26,100.62,101.33,2.61091,255.463,19905.0,29374.914,5.34,4.2,103.20999908447266,103.5500030517578,102.91999816894533,103.08999633789062
2024-08-09,GBPUSD,Negative,GBPUSD hags near YTD low remains vulnerable below 200 DMA amid bullish USD,Haresh Menghani,https://www.fxstreet.com/news/gbp-usd-hags-near-ytd-low-remains-vulnerable-below-200-dma-amid-bullish-usd-202303080839,FX Street,"The GBP/USD pair consolidates the previous day's heavy losses and oscillates in a narrow band, just a few pips above its lowest level since November set earlier this Wednesday. The pair trades around the 1.1825 region during the first half of the European session and remains vulnerable below a technically significant 200-day Simple Moving Average (SMA). The US Dollar bulls take a breather following the recent strong run-up to a three-month top amid signs of stability in the equity markets. This, along with the extremely oversold Relative Strength Index (RSI) on hourly charts, is seen lending some support to the GBP/USD pair. That said, any meaningful recovery still seems elusive amid rising bets for more aggressive policy tightening by the Federal Reserve. In fact, the markets are now pricing in a greater chance of a jumbo 50 bps lift-off at the March FOMC policy meeting. The bets were lifted by Fed Chair Jerome Powell's remarks on Tuesday, indicating that interestratesmight need to go up faster and higher than previously anticipated. Powell further added that the Fed is prepared to increase the pace of rate hikes to combat stubbornly high inflation. The hawkishoutlookremains supportive of elevated US Treasury bond yields, which, along with looming recession risks, support prospects for a further near-term appreciating move for the safe-haven Greenback. In fact, the yield on the benchmark 10-year US government bond holds steady around the 4.0% threshold and the rate-sensitive two-year Treasury note stands tall near its highest level since 2007. This adds to worries about economic headwinds stemming from rapidly rising borrowing costs. Apart from this, fading hopes over a strong Chinese economic recovery and US-China tensions should keep a lid on any optimism in the markets. Moreover, an additional rate hike by theBank of England(BoE) is already priced in, suggesting that the path of least resistance for the GBP/USD pair is to the downside. Market participants now look to theUS economic docket, featuring the release of the ADP report on private-sector employment and JOLTS Job Openings data. This, along with the broader risk sentiment, Powell's second day of testimony before the House Financial Services Committee and the US bond yields, should influence the USD and provide some meaningful impetus tothe GBP/USD pair. Technical levels to watch GBP/USD  ",Negative,-0.83,140309.0,united states,47.4,50.5,69.7,0.055,0.034,0.039,0.037,0.031,dxy,103.36,104.26,100.62,101.33,2.61091,255.463,19905.0,29374.914,5.34,4.2,103.13999938964844,103.3000030517578,103.02999877929688,103.2699966430664
2024-08-12,EURUSD,Neutral,ECB’s Visco Monetary policy will have to remain prudent,Dhwani Mehta,https://www.fxstreet.com/news/ecbs-visco-monetary-policy-will-have-to-remain-prudent-202303080916,FX Street,"European Central Bank(ECB) Governing Council member Ignazio Visco said in a statement on Wednesday, “monetary policy will have to remain prudent.” “Monetary policy should be guided by data as it becomes available,” Visco added. Market reaction EUR/USDis in a downside consolidation mode below 1.0550 so far this Wednesday. The spot is down 0.05% on the day.",Neutral,0.08,125697.0,united states,47.4,50.5,69.7,0.055,0.034,0.039,0.037,0.031,dxy,103.36,104.26,100.62,101.33,2.61091,255.463,19905.0,29374.914,5.34,4.2,103.13999938964844,103.30999755859376,103.08999633789062,103.1500015258789
2024-08-13,EURUSD,Positive,EURUSD 10500 can be broken today or tomorrow – ING,FXStreet Insights Team,https://www.fxstreet.com/news/eur-usd-10500-can-be-broken-today-or-tomorrow-ing-202303081001,FX Street,"The Powell-ledEUR/USDdrop yesterday means that the next key support for the pair is now 1.0500. This level could be broken in the next two days, economists at ING report. Euro has not got many weapons to fight the Dollar strengthening at the moment “The Euro hasn’t got many weapons to fight the Dollar strengthening at the moment. The Eurozone’s data calendar lacks market-moving releases and a speech byLagardetoday does not seem to have much to do with monetary policy. Two of the most dovish ECB members – Ignazio Visco and Fabio Panetta – are the other scheduled speakers today, so expect little support to the Euro on that front.” “Today and tomorrow will offer the best opportunity – in our view – to press below 1.0500, while we favour a EUR/USD rebound on a softer US jobs report on Friday.” ",Neutral,-0.07,188004.0,united states,47.4,50.5,69.7,0.055,0.034,0.039,0.037,0.031,dxy,103.36,104.26,100.62,101.33,2.61091,255.463,19905.0,29374.914,5.34,4.2,102.55999755859376,103.2699966430664,102.5500030517578,103.08999633789062
