Date,ticker_x,true_sentiment,title,author,url,source,text,finbert_sentiment,finbert_sent_score,Volume,country,manufacturing pmi,services pmi,consumer confidence,interest rates,cpi yoy,core cpi,unemployment rate,gdp yoy,ticker_y,open,high,low,close,CPIAUCSL_PC1,PPIACO,PCE,GDP,SOFR,UNRATE,Close,High,Low,Open
2024-03-18,AUDUSD,Neutral,AUDUSD touches fresh daily top near 06765 region upside potential seems limited,Haresh Menghani,https://www.fxstreet.com/news/aud-usd-touches-fresh-daily-top-near-06765-region-upside-potential-seems-limited-202303030950,FX Street,"The AUD/USD pair regains positive traction on the last day of the week and builds on its steady intraday descent through the first half of the European session. The momentum lifts spot prices to a fresh daily high, around the 0.6765 region in the last hour, and is sponsored by the emergence of fresh selling around theUS Dollar. A modest pullback in the US Treasury bond yields is turning out to be a key factor exerting some downward pressure on the buck. Adding to this, the upbeat Chinese macro data fueled optimism about a strong recovery in the world's second-largest economy, which further dents the Greenback's safe-haven status and provides an additional boost to the China-proxy Australian Dollar. That said, a combination of factors might hold back bulls from placing aggressive bets around the AUD/USD pair and keep a lid on any further gains, at least for the time being. Firming expectations that the Federal Reserve will stick to its hawkish stance for longer in the wake of stubbornly high inflation should act as a tailwind for the US bond yields and lend support to the USD. The bets were lifted by hawkish commentary by a slew of influential FOMC members, stressing the need for higher rate hikes to fully gain control over inflation. This had pushed the yield on the benchmark 10-year US government bond to its highest level since last November and the rate-sensitive two-year Treasury note to levels last seen in July 2007 on Thursday. Furthermore, worries about economic headwinds stemming from rapidly rising borrowing costs continue to weigh on investors' sentiment. This is evident from the prevalent cautious mood around the equity markets, which should further help limit losses for the Greenback and contribute to capping the upside for the AUD/USD pair. Even from a technical perspective, the recent breakdown below the very important 200-day Simple Moving Average (SMA) favours bearish trades and suggests that the path of least resistance for spot prices remains to the downside. Market participants might also refrain from placing aggressive bets ahead of next week's Reserve Bank of Australia (RBA) monetary policy meeting. In the meantime, traders on Friday will take cues from the US ISM Services PMI, due for release later during the early North American session. This, along with the US bond yields and the risk sentiment, will drive the USD demand and produce short-term trading opportunities around the AUD/USD pair. Technical levels to watch AUD/USD  ",Positive,0.1,145179.0,united states,47.4,50.5,69.7,0.055,0.034,0.039,0.037,0.031,dxy,103.36,104.26,100.62,101.33,3.469,255.095,19553.2,28624.069,5.31,3.9,103.58000183105467,103.6500015258789,103.33999633789062,103.4499969482422
2024-03-19,AUDUSD,Negative,Further downside is possible in AUDUSD and NZDUSD before eventual basing and rebounds develop – CIBC,FXStreet Insights Team,https://www.fxstreet.com/news/further-downside-is-possible-in-aud-usd-and-nzd-usd-before-eventual-basing-and-rebounds-develop-cibc-202303031001,FX Street,"Both AUD and NZD have given up ground to a firmer USD over recent weeks. Economists at CIBC Capital Markets anticipate some further consolidation before lows are established. Further consolidation before lows are established “We retain a medium-term positiveoutlookfor both the Australian and New Zealand Dollars. But we anticipate further downside is possible in both AUD/USD andNZD/USDbefore eventual basing and rebounds develop.” “The greater degree of tightening still to be delivered byRBArelative to RBNZ is something we see supporting AUD vs NZD, and we target a move to 1.1200.” “Both also continue to have risks from overall slower global growth. A confirmed recovery in China and eventual turn lower in the USD does provide some counter to that risk. Though we see that more of a 2Q-3Q story than during the current period.” ",Negative,-0.5,186689.0,united states,47.4,50.5,69.7,0.055,0.034,0.039,0.037,0.031,dxy,103.36,104.26,100.62,101.33,3.469,255.095,19553.2,28624.069,5.31,3.9,103.80999755859376,104.05999755859376,103.58000183105467,103.58999633789062
2024-03-20,EURUSD,Positive,EURUSD regains the smile and the area above 10600,Pablo Piovano,https://www.fxstreet.com/news/eur-usd-regains-the-smile-and-the-area-above-10600-202303031001,FX Street,"Renewed selling pressure in the greenback allowsEUR/USDto pick up pace and reclaim the area beyond 1.0600 the figure at the end of the week. EUR/USD now looks at US data EUR/USD keeps the choppy price action well and sound so far this week amidst an equally vacillating performance in the greenback, while yields on both sides of the ocean now give away some gains and investors continue to monitor messages from both the ECB and the Fed. On the latter, ECB’s Vice-President De Guindos suggested earlier that headline inflation should fall below 6% at some point in mid-year, at the time when he reiterated that decisions on future rate hikes will remain data-dependent and that the economy of the region is doing better than expected. His colleague Vasle left the door open to further rate raises after the March event, a view shared by Board member Müller. In addition, Müller was unable to predict how far up rates may go. In the domestic calendar, final figures saw Services PMI in Germany and the broader Euroland at 50.9 and 52.7, respectively, for the month of February. In addition, Producer Prices in the euro area contracted 2.8% MoM in January and rose 15% from a year earlier and earlier data saw Germany’s trade surplus widen to €16.7B in January.  In the US, all the attention will be on the release of the ISM Manufacturing seconded by the final prints of theManufacturing PMI. In addition, FOMC’s Logan, Bostic, Barkin and Bowman are all due to speak later in the NA session. What to look for around EUR EUR/USD regains some balance and looks to extend the trade beyond the 1.0600 yardstick amidst the broad-based consolidative mood. In the meantime, price action around the European currency should continue to closely follow dollar dynamics, as well as the potential next moves from the ECB after the bank has already anticipated another 50 bps rate raise at the March event. Back to the euro area, recession concerns now appear to have dwindled, which at the same time remain an important driver sustaining the ongoing recovery in the single currency as well as the hawkish narrative from the ECB. Key events in the euro area this week: Germany Balance of Trade, Final Services PMI, EMU Final Services PMI (Friday). Eminent issues on the back boiler: Continuation of theECBhiking cycle amidst dwindling bets for a recession in the region and still elevated inflation. Impact of the Russia-Ukraine war on the growth prospects and inflationoutlookin the region. Risks of inflation becoming entrenched. EUR/USD levels to watch So far, the pair is advancing 0.16% at 1.0614 and the breakout of 1.0714 (55-day SMA) would target 1.0804 (weekly high February 14) en route to 1.1032 (2023 high February 2). On the other hand, there is an immediate support at 1.0532 (monthly low February 27) seconded by 1.0481 (2023 low January 6) and finally 1.0326 (200-day SMA).",Positive,0.52,232085.0,united states,47.4,50.5,69.7,0.055,0.034,0.039,0.037,0.031,dxy,103.36,104.26,100.62,101.33,3.469,255.095,19553.2,28624.069,5.31,3.9,103.41000366210938,104.1500015258789,103.37999725341795,103.83999633789062
2024-03-21,GBPUSD,Positive,Trend stronger for GBP later in the year – MUFG,FXStreet Insights Team,https://www.fxstreet.com/news/trend-stronger-for-gbp-later-in-the-year-mufg-202303031036,FX Street,"Economists at MUFG analyze the GBPoutlook. TheBritish Poundsees brighter prospects later in the year. Short-term downside risks “We maintain our view of short-term downside risks as inflation remains a concern and risk conditions remain fragile. However, assuming inflation falls notably and theBrexitdeal just agreed improves relations with Europe, we see scope for some GBP outperformance after a sustained period of negativity for the UK.” “EUR/GBP – Q1 2023 0.8800 Q4 2023 0.8700 Q3 2023 0.8650 Q4 2023 0.8500” “GBP/USD – Q1 2023 1.1930  Q2 2023 1.2410  Q3 2023 1.2720 Q4 2023 1.3180” ",Positive,0.85,279975.0,united states,47.4,50.5,69.7,0.055,0.034,0.039,0.037,0.031,dxy,103.36,104.26,100.62,101.33,3.469,255.095,19553.2,28624.069,5.31,3.9,104.0,104.0500030517578,103.16999816894533,103.23999786376952
2024-03-22,GBPUSD,Negative,GBPUSD Break below 11920 could fuel more downward pressure –  OCBC,FXStreet Insights Team,https://www.fxstreet.com/news/gbp-usd-break-below-11920-could-fuel-more-downward-pressure-ocbc-202303031123,FX Street,"GBP/USD suffered heavy losses and closed below 1.2000 on Thursday. A break under the 1.1920 mark could trigger another leg lower, economists at OCBC Bank report. Descending triangle? “Daily momentum and RSIindicatorsare not showing a clear bias. But on the weekly chart, bullish momentum is fading fast while RSI fell.” “A potential descending triangle could be forming with support at 1.1920 levels (200-DMA, triangle support). A decisive break to the downside could fuel more downward pressure. Next support at 1.1840, 1.1720 levels.” “Resistance at 1.2045 (21-DMA), 1.2140 (50-DMA).” ",Negative,-0.93,245799.0,united states,47.4,50.5,69.7,0.055,0.034,0.039,0.037,0.031,dxy,103.36,104.26,100.62,101.33,3.469,255.095,19553.2,28624.069,5.31,3.9,104.43000030517578,104.5,103.91999816894533,103.98999786376952
2024-03-25,EURUSD,Negative,EURUSD Push under 10580 might see a bit more downward pressure develop – Scotiabank,FXStreet Insights Team,https://www.fxstreet.com/news/eur-usd-push-under-10580-might-see-a-bit-more-downward-pressure-develop-scotiabank-202303031308,FX Street,EUR/USD edges higher but modest gains encounter selling pressure. Economists at Scotiabank analyze the pair’s technical picture. Resistance aligns at 1.0650 “EUR/USD has recovered from yesterday’s low around 1.0577 but gains have been slight and the short-term chart suggests that the EUR is running into firm selling pressure in the low 1.06s. “Renewed weakness and a push under minor support intraday at 1.0580 might see a bit more downward pressure on the EUR develop.” “Resistance is 1.0650.” See –EUR/USD: Volatility in a 1.05-1.10 range depending on the data in Q2 – ING ,Negative,-0.33,152387.0,united states,47.4,50.5,69.7,0.055,0.034,0.039,0.037,0.031,dxy,103.36,104.26,100.62,101.33,3.469,255.095,19553.2,28624.069,5.31,3.9,104.2300033569336,104.4800033569336,104.13999938964844,104.43000030517578
2024-03-26,USDJPY,Negative,USDJPY Price Analysis Flirts with daily low around 13600 mark amid weaker USD,Haresh Menghani,https://www.fxstreet.com/news/usd-jpy-price-analysis-flirts-with-daily-low-around-13600-mark-amid-weaker-usd-202303031324,FX Street,"TheUSD/JPY pairstops and reverses the early selling bias on Friday and spikes higher after the release of US data from ISM compiled from surveys of purchasing managers in the services sector beat expectations. The results suggested the American economy is still in fine form and the Fed will need to continue tightening policy aggressively in its wrestle with the beast of inflation. Nevertheless, gains proved temporary as the pair gradually fell back down to the lower 136s after the initial furious rally higher. TheISMNon-Manufactruing PMI data for February, showed a rise to 55.1, roundly beating expectations of 54.5, and almost pipping the previous month's 55.2.US Dollarpairs reacted immediately, and began rising as traders bet on the Federal Reserve having to step in with sterner disinflationary measures, perhaps even raising interest rates more aggressively than is currently expected, with probabilities steadily rising of the higher 50 bps rate hike coming from the Fed in March. The data also showed a rise in the Employment component of the survey, to 54.0 from 50.0 and New Orders to 62.6 from 60.4. Price Paid fell to 65.6 from 67.8, however, offsetting the hype marginally and suggesting a slight easing in inflationary forces. The Business Activity component, meanwhile showed a fall 56.3 from 60.4. From a technical perspective, the USD/JPY pair is in a short-to-medium term uptrend which is expected to extend given a lack of reversal signs so far. Yet lately it has struggled to break above the 100 and 200-day Simple Moving Averages (SMA) between 136.50 and 137.00 and these appear to be successfully baring further growth. If bulls can successfully break above them, however, it will also confirm a breakout through the 38.2% Fibonacci retracement level of the recent pullback from over a three-decade high and pave the way for additional gains. The USD/JPY pair might then accelerate the move to reclaim the 138.00 mark en route to the 138.75 zone, the 139.00 round figure and the 139.60 region (50% Fibo. level). On the flip side, sustained weakness below the 136.00 level might prompt some technical selling and drag the USD/JPY pair to the weekly low, around the 135.25 region. It would require a break below the key 134.05 February 24 low – the last key higher low of the previous uptrend – to reverse the sequence of rising peaks and troughs and define the beginning of a new downtrend. A key event for the USD/JPY pair will be the Bank of Japan (BoJ) policy meeting next week. That said, a convincing break below the 134.05 low could make spot prices vulnerable to sliding further towards the 23.6% Fibo. level support, just ahead of the 133.00 mark. USD/JPY daily chart  Key levels to watch USD/JPY  ",Negative,-0.44,169781.0,united states,47.4,50.5,69.7,0.055,0.034,0.039,0.037,0.031,dxy,103.36,104.26,100.62,101.33,3.469,255.095,19553.2,28624.069,5.32,3.9,104.29000091552734,104.33999633789062,104.01000213623048,104.22000122070312
2024-03-27,EURUSD,Neutral,When is the US ISM Services PMI and how could it affect EURUSD,Haresh Menghani,https://www.fxstreet.com/news/when-is-the-us-ism-services-pmi-and-how-could-it-affect-eur-usd-202303031356,FX Street,"US ISM Services PMI Overview The Institute of Supply Management (ISM) will release the Non-Manufacturing Purchasing Managers' Index (PMI) - also known as the ISM Services PMI – at 15:00 GMT this Friday. The gauge is expected to come in at 54.5 for February, down from 55.2 in the previous month. Given that the Fed looks more at inflation than growth, investors will keep a close eye on the Prices Paid sub-component, which is anticipated to decelerate from 67.8 in January to 64.5 during the reported month. Economists at ING offer a brief preview of the important macro data and write: “Consensus is centred around a marginal decrease from 55.2 to 54.5, which would confirm speculation on recession is too premature and would continue to endorse the Fed’s hawkish rhetoric. We think this should allow further stabilisation of the Dollar around current levels.” How Could it Affect EUR/USD? Ahead of the key release, retreating US Treasury bond yields prompts some selling around the US Dollar. This, along with the overnight hawkish comments by ECB President Christine Lagarde, assiststhe EUR/USD pairto regain positive traction on the last day of the week. Any disappointment from the US ISM Services PMI could exert additional downward pressure on the Greenback and continue pushing the pair higher. That said, the market reaction is more likely to remain limited amid growing acceptance that the Fed will continue to tighten its monetary policy to combat stubbornly high inflation. Hence, a stronger headline print and higher-than-expected Prices Paid Index should be enough to trigger a fresh leg up in the US bond yields, which, in turn, should help revive the USD demand. Apart from this, looming recession risks should continue to act as a tailwind for the safe-haven buck. This, in turn, suggests that the path of least resistance for the EUR/USD pair is to the downside and any subsequent move up might still be seen as a selling opportunity. Eren Sengezer, Editor atFXStreet, offers a brief technical outlook and outlines important technical levels to trade the major: “EUR/USD is currently trading slightly above the descending regression channel coming from early February. The 20-period and the 50-period Simple Moving Averages (SMA) reinforce that resistance area that aligns at 1.0610/1.0620. Once the pair stabilizes above that hurdle, it could target 1.0650/60 (Fibonacci 23.6% retracement of the latest downtrend, 100-period SMA), 1.0700 (psychological level) and 1.0720 (Fibonacci 38.2% retracement)..” “On the other hand, if the pair returns within the descending channel, sellers could take action and cause EUR/USD to slide toward 1.0560 (mid-point of the descending channel), 1.0540 (static level) and 1.0500 (psychological level, lower limit of the descending channel), .” Eren adds further. Key Notes •ISM Services PMI Preview: Strong figure set to catapult US Dollar to new highs •US February ISM Services PMI Preview: Will it influence Fed rate hike bets? •EUR/USD Forecast: Investors struggle to make up their minds about Euro's direction About the US ISM manufacturing PMI The Institute for Supply Management (ISM) Manufacturing Index shows business conditions in the US manufacturing sector. It is a significant indicator of the overall economic condition in the US. A result above 50 is seen as positive (or bullish) for the USD, whereas a result below 50 is seen as negative (or bearish).",Neutral,-0.05,158653.0,united states,47.4,50.5,69.7,0.055,0.034,0.039,0.037,0.031,dxy,103.36,104.26,100.62,101.33,3.469,255.095,19553.2,28624.069,5.33,3.9,104.3499984741211,104.45999908447266,104.22000122070312,104.3000030517578
2024-03-28,EURUSD,Positive,EURUSD Price Analysis Bulls need to clear the 55day SMA,Pablo Piovano,https://www.fxstreet.com/news/eur-usd-price-analysis-bulls-need-to-clear-the-55-day-sma-202303031445,FX Street,"EUR/USDpick up pace and reverses, albeit partially, Thursday’s decline at the end of the week. Occasional bullish attempts need to clear the provisional hurdle at the 55-day SMA, today at 1.0714, to allow for extra gains to, initially, the weekly top at 1.0804 (February 14). Looking at the longer run, the constructive view remains unchanged while above the 200-day SMA, today at 1.0326. EUR/USD daily chart  EUR/USD  ",Neutral,-0.01,234791.0,united states,47.4,50.5,69.7,0.055,0.034,0.039,0.037,0.031,dxy,103.36,104.26,100.62,101.33,3.469,255.095,19553.2,28624.069,5.34,3.9,104.5500030517578,104.7300033569336,104.30999755859376,104.44000244140624
2024-04-01,USDJPY,Positive,USDJPY holds the 200 hour MA for the 3rd time in 6 days,Greg Michalowski,https://www.forexlive.com/technical-analysis/usdjpy-holds-the-200-hour-ma-for-the-3rd-time-in-6-days-20230303/,Forex Live,"The 200 hour MA has been a magnet for the USDJPY over the last 6 trading days, but once reached, the price has seen a push away. That MA (green line in the chart above), was tested last Friday and bounced. It was tested on Wednesday this week and bounced. Today the price got within 5 or so pips of the MA, and once again bounced. That is 3 tests in 6 days and 3 bounces. If you go back to February 10, after a failed break below the 200 hour MA, that same MA based the pair before moving higher. The point is... the 200 hour MA has been a bullish barometer for the USDJPY.  It also has been a level that traders have been leaning against on the dips EVEN THOUGH it is at progressively at higher levels. That is the bullish. The not so bullish you is the price action this week has run into some formidable resistance above that has been able to put a lid on the rallies too.  More specifically, the 100 day MA currently at 136.79 and the 200 day MA currently at 137.28 are key resistance targets. During trading yesterday, the price did move above the 100 day MA, on two separate occasions only to find willing sellers.  The 200 day MA was not threatened. With the price currently trading at 136.277, the pair sits between the 100 day MA above at 136.79 and the 200 hour MA below at 135.746. In between THOSE level sits the 100 hour MA at 136.328. That 100 hour MA will be an interim barometer. So... the battle goes on.  Traders will be looking for the next shove. On the top side it would be to get above the 100 day moving average and then the 200 day moving average (see blue and green lines on the chart below). ON the downside, the importance of holding the 200 hour moving average is important. Will blow it and stay below would open the door for more downside corrective probing in the pair. PS the low to high trading range for the USDJPY this week is only 184 pips. That is the lowest trading range since 171 pips back in September, and the fourth lowest trading range over the last year. The market is non-trending, helped by the the technical levels in play. The narrow trading range supports the view that the market is building up for a break and a run.",Neutral,0.12,147429.0,united states,47.4,50.5,69.7,0.055,0.034,0.039,0.037,0.031,dxy,103.36,104.26,100.62,101.33,3.35405,256.978,19603.3,29016.714,5.35,3.9,105.0199966430664,105.08000183105467,104.41999816894533,104.48999786376952
2024-04-02,USDJPY,Negative,USDJPY Price Analysis Retraces toward 13600 on soft USD,Christian Borjon Valencia,https://www.fxstreet.com/news/usd-jpy-price-analysis-retraces-toward-13600-on-soft-usd-202303031814,FX Street,"The USD/JPY slides from 136.70s toward the 136.00 area on Friday amidst broadUS Dollar(USD) weakness even though data cemented the US economy resilience. At the time of writing, the USD/JPY exchanges hands at 136.02. USD/JPY Price Action From a daily chart perspective, the USD/JPY is neutral upward biased, despite dropping from weekly highs toward the 136.10s area. If the USD/JPY bears reclaim the 136.00 figure, that would open the door for further losses. The first support would be the March 1 low of 135.25, followed by strong support below 135.00. Firstly the 100-day EMA at 134.90, followed by the 20-day EMA at 134.39, and then the 134.00 mark. On the other hand, a bullish continuation would continue if USD/JPY bulls hold prices above 136.00. The first resistance would be the December 20 high at 136.77, followed by the psychological 137.00 mark. USD/JPY Daily chart  USD/JPY Technical levels USD/JPY  ",Neutral,-0.05,234935.0,united states,47.4,50.5,69.7,0.055,0.034,0.039,0.037,0.031,dxy,103.36,104.26,100.62,101.33,3.35405,256.978,19603.3,29016.714,5.34,3.9,104.81999969482422,105.0999984741211,104.68000030517578,105.0
