Date,ticker_x,true_sentiment,title,author,url,source,text,finbert_sentiment,finbert_sent_score,Volume,country,manufacturing pmi,services pmi,consumer confidence,interest rates,cpi yoy,core cpi,unemployment rate,gdp yoy,ticker_y,open,high,low,close,CPIAUCSL_PC1,PPIACO,PCE,GDP,SOFR,UNRATE,Close,High,Low,Open
2024-11-20,USDJPY,Positive,USDJPY Strong bout of US data could reopen a move to 140 – TDS,FXStreet Insights Team,https://www.fxstreet.com/news/usd-jpy-strong-bout-of-us-data-could-re-open-a-move-to-140-tds-202303101146,FX Street,"Kuroda's final meeting as Governor of the BoJ delivered no surprises. The reaction in the JPY was rather muted. The ball is in the USD's court with the all-important Nonfarm Payrolls report eyed, economists at TD Securities report. Kuroda rides off into the sunset with no surprises “Kuroda wraps up his final meeting as Governor with no surprise and left all policy tools unchanged. Despite this, a future adjustment to YCC remains likely under Ueda. We expect Ueda will order a policy review early on, which we think will serve as a platform to make changes to YCC as early as Q2.” “USD/JPY at +137 should be key resistance ahead of theNFP. But the ball is in the USD's court for now, and shouldjobssignificantly surprise to the upside (>300K) alongside a strong CPI report next week, 140 does not seem implausible.” “We expect to see more insulation on cross/JPY however. This is because strong US data will rock all boats but especially the dollar bloc. A re-test of 95/96 in CAD/JPY seems reasonable, particularly as the CAD looks rather vulnerable to the USD with 1.40 now within sight.” See –NFP Preview: Forecasts from 10 major banks, many new jobs created",Positive,0.82,173005.0,united states,47.4,50.5,69.7,0.055,0.034,0.039,0.037,0.031,dxy,103.36,104.26,100.62,101.33,2.71417,253.211,20235.1,29723.864,4.56,4.2,106.68000030517578,106.91999816894533,106.11000061035156,106.12000274658205
2024-11-21,EURUSD,Negative,EURUSD Prone to renewed softness on the charts – Scotiabank,FXStreet Insights Team,https://www.fxstreet.com/news/eur-usd-prone-to-renewed-softness-on-the-charts-scotiabank-202303101239,FX Street,"EUR/USD is tradingmodestly higher. However, economists at Scotiabank note that technicals are leaning bearish for the pair. Key support aligns at  1.0535 “The EUR’s rebound from the mid-week low (equating to a test of the 100-Day Moving Average at 1.0536) may be faltering. Intraday price action suggests a peak/reversal developed, with the EUR topping out via a bearish outside range session on the 6-hourchartaround 1.0605 (resistance).” “Intraday losses are pressuring minor support around 1.0585 and should extend more obviously below 1.0575.” “Key support is 1.0535.” ",Negative,-0.76,220058.0,united states,47.4,50.5,69.7,0.055,0.034,0.039,0.037,0.031,dxy,103.36,104.26,100.62,101.33,2.71417,253.211,20235.1,29723.864,4.57,4.2,106.97000122070312,107.16000366210938,106.45999908447266,106.58999633789062
2024-11-22,GBPUSD,Positive,GBPUSD Sustained push back above 100DMA at 12017 should enhance the rebound – Scotiabank,FXStreet Insights Team,https://www.fxstreet.com/news/gbp-usd-sustained-push-back-above-100-dma-at-12017-should-enhance-the-rebound-scotiabank-202303101311,FX Street,"GBP gains have extended today to retest the 1.20 area. A move above the 100-Day Moving Average (DMA) of 1.2017 could enhance Pound’s rebound, economists at Scotiabank report. January GDP rebound “Jan industrial and manufacturing activity was a little weaker than expected but service sector growth was stronger, driving a 0.3% gain in monthly GDP, above the 0.1% gain expected. The data suggest the UK economy may hold up better than most have been expecting in the early part of this year and might possibly avoid a recession.” “A sustained push back above 1.2017 (100-DMA) should enhance the Pound’s rebound but that may be a bit of a reach in the short run, with trend signals tilted bearishly for the GBP on daily and weekly studies.” ",Positive,0.93,319761.0,united states,47.4,50.5,69.7,0.055,0.034,0.039,0.037,0.031,dxy,103.36,104.26,100.62,101.33,2.71417,253.211,20235.1,29723.864,4.57,4.2,107.48999786376952,108.06999969482422,106.91999816894533,107.05999755859376
2024-11-25,USDJPY,Negative,USDJPY falls to test daily lows near 13580 after NFP,Matías Salord,https://www.fxstreet.com/news/usd-jpy-falls-to-test-daily-lows-near-13580-after-nfp-202303101343,FX Street,"TheUSD/JPYdropped to levels sub 136.00 following the release of the US employment report. The US Dollar weakened across the board while US yields hit fresh daily lows. The US Bureau of Labor Statistics (BLS) revealed on Friday thatNonfarm Payrolls rose by 311,000 in February, above the market expectation of 205,000. January’s numbers were marginally revised from 517,000 to 504,000. The Labor Force Participation Rate improved modestly to 62.5% from 62.4% in January and theUnemployment Raterose to 3.6%. Average Hourly Earnings increased by 4.6% from a year ago. The US Dollar dropped to fresh lows across the board while USstockindex futures turned positive. Markets are digesting the job’s report. The Yen benefit amid a decline in US Yields. The 10-year yield fell to 3.76% and the 2-year hit level under 4.70%. The USD/JPY dropped almost a hundred pips afterNFP. It was trading around 136.70 and bottomed so far at 135.83, slightly above the Asian session low. The daily lows area in USD/JPY is being challenged at the moment, and a break lower could trigger an acceleration. On the upside, a recovery above 137.00 could strengthen the US Dollar, exposing weekly highs near 138.00. Technical levels USD/JPY  ",Negative,-0.91,251982.0,united states,47.4,50.5,69.7,0.055,0.034,0.039,0.037,0.031,dxy,103.36,104.26,100.62,101.33,2.71417,253.211,20235.1,29723.864,4.58,4.2,106.81999969482422,107.25,106.58000183105467,107.25
2024-11-26,AUDUSD,Positive,AUDUSD refreshes daily top amid postNFP USD selloff lacks followthrough,Haresh Menghani,https://www.fxstreet.com/news/aud-usd-refreshes-daily-top-amid-post-nfp-usd-sell-off-lacks-follow-through-202303101405,FX Street,"TheAUD/USDpair stages a modest recovery from a fresh four-month low set earlier this Friday and the momentum picks up pace during the early North American session. The latest leg of a sudden spike in the last hour follows the release of the mixed USjobsdata and lifts spot prices to a fresh daily peak, around the 0.6630 region. The US Dollar weakens across the board after the headlineNFPshowed that the US economy added 311K new jobs in February, well below the previous month's downwardly revised reading of 504K. Adding to this, the jobless rate unexpectedly rose to 3.6% from the 3.4% previous and wages also fell short of market estimates, rising by 0.2% for the month and a 4.6% YoY rate. The slight disappointment was enough to force investors to scale back expectations for a more aggressive policy tightening by the Federal Reserve (Fed). In fact, the markets are now pricing in a greater chance of a 25 bps lift-off at the upcoming FOMC meeting on March 21-22, which continues to drag the US Treasury bond yields lower and is seen weighing on the Greenback. Apart from this, a modest recovery in the US equity futures further undermines the safe-haven buck and benefits the risk-sensitive Australian Dollar. That said, the lack of strong follow-through buying, along with the Reserve Bank of Australia's dovish shift earlierthis week, some warrants caution for bulls and before placing aggressive bullish bets around the AUD/USD pair. Technical levels to watch AUD/USD  ",Negative,-0.14,264764.0,united states,47.4,50.5,69.7,0.055,0.034,0.039,0.037,0.031,dxy,103.36,104.26,100.62,101.33,2.71417,253.211,20235.1,29723.864,4.58,4.2,107.01000213623048,107.5,106.48999786376952,107.48999786376952
2024-11-27,USDJPY,Negative,USDJPY A bigger retracement could be on the horizon – MUFG,FXStreet Insights Team,https://www.fxstreet.com/news/usd-jpy-a-bigger-retracement-could-be-on-the-horizon-mufg-202303101410,FX Street,"Governor Kuroda’s last monetary policy meeting ended without any surprise policy changes. USD/JPY jumped in reaction. However, economists at MUFG Bank expect the pair to turn back lower. Bank of Japan left its policy settings unchanged “There had been a small degree of speculation thatKurodacould make further changes to YCC given the continued dysfunctional JGB market conditions so the unchanged policy announcement has fuelled some Yen selling.” “USD/JPY has bounced on the back of the BoJ policy announcement but the developments in the US seem far more significant and given the US yield move, a bigger retracement inUSD/JPYcould be on the horizon.” ",Neutral,0.14,263104.0,united states,47.4,50.5,69.7,0.055,0.034,0.039,0.037,0.031,dxy,103.36,104.26,100.62,101.33,2.71417,253.211,20235.1,29723.864,4.57,4.2,106.08000183105467,106.91999816894533,105.86000061035156,106.81999969482422
2024-11-29,EURUSD,Positive,EURUSD Further rise to 112 until mid2024 – Commerzbank,FXStreet Insights Team,https://www.fxstreet.com/news/eur-usd-further-rise-to-112-until-mid-2024-commerzbank-202303101435,FX Street,"Economists at Commerzbank have adjusted theirEUR/USD forecastfor the next year. EUR is likely to weaken again in the second half of next year “We now expect rates to peak at 6% (previously 5.5%) in the US and at 4% in theEurozone(previously 3.5%). However, what is more decisive for our EUR/USD projections is that we do not expect any ECB rate cuts until the end of the forecasting horizon in late 2024 anymore, whereas we assume that the US will lower its key rate even further in 2024 than previously projected.” “We have left our EUR/USD projections for 2023 unchanged, but now expect a further rise inEUR/USDto 1.12 until mid-2024.” “Only in the second half of next year EUR is likely to weaken again as the realisation is then going to take effect that inflation in the Eurozone is more stubborn and that the ECB was not restrictive enough to return inflation to its target. This will put pressure on the Euro.”  Source: Commerzbank Research ",Positive,0.81,54132.0,united states,47.4,50.5,69.7,0.055,0.034,0.039,0.037,0.031,dxy,103.36,104.26,100.62,101.33,2.71417,253.211,20235.1,29723.864,4.59,4.2,105.73999786376952,106.12999725341795,105.62000274658205,105.9499969482422
2024-12-02,EURUSD,Neutral,USDCHF to reach 095 on a threemonth view – Rabobank,FXStreet Insights Team,https://www.fxstreet.com/news/usd-chf-to-reach-095-on-a-three-month-view-rabobank-202303101535,FX Street,"The FOMC will maintain the ‘higher for longer’outlookfor interest rate policy. Thus, economists at Rabobank expect the US Dollar to streghthen, driving EUR/USD and USD/CHF to 1.05 and 1.05 on a three-month view, respectively. USD will remain underpinned this year “Earlierthis week, the hawkish tone of Chair Powell’s testimony led to an increase in market expectations that the Fed could hike interest rates by 50 bps at its March policy meeting. His tone was pared back a touch on the second leg of his hearing the following day when he indicated that the discussion about the size of the move was still in play.” “For choice, we maintain the view that policymakers will be forced into holding rates higher for longer to push inflation back to the 2% level.” “We maintain our expectation that the USD will remain underpinned this year. We see risk of dips toEUR/USD1.05 on a three-month view and forecast USD/CHF at 0.95 in three months.” ",Positive,0.84,262001.0,united states,47.4,50.5,69.7,0.055,0.034,0.039,0.037,0.031,dxy,103.36,104.26,100.62,101.33,2.87237,253.423,20408.1,29723.864,4.64,4.1,106.4499969482422,106.7300033569336,105.81999969482422,105.81999969482422
2024-12-03,GBPUSD,Positive,"US dollar tumbles further. A technical look at the USDCHF and GBPUSD, the biggest movers.",Greg Michalowski,https://www.forexlive.com/technical-analysis/us-dollar-tumbles-further-into-the-downside-a-tech-look-at-the-usdchf-and-gbpusd-20230310/,Forex Live,"The USD is moving to new session lows against all the major currencies. The dollars declines are the greatest versus the CHF and the GBP (see chart above). The USDCHF is now down close to -1.55%. The greenback is lower by -1.52% against the GBP. The USDCHF tumble is the largest one-day decline since November 11, 2022 when the pair fell -2.29%. The GBPUSDs move is its largest rise (lower USD) since December 1, 2022 when it gained 1.648% USDCHF: TheUSDCHFUSD/CHFThe USD/CHF is the currency pair encompassing the dollar of the United States of America (symbol $, code USD), and the Swiss franc of Switzerland (code CHF). The pair’s exchange rate indicates how many Swiss francs are needed in order to purchase one US dollar. For example, when the USD/CHF is trading at 1.2500, it means 1 US dollar is equivalent to 1.25 Swiss francs.  The US Dollar (USD) is the world’s most traded currency, whilst the Swiss franc (CHF) is the world’s sixth most traded currency,The USD/CHF is the currency pair encompassing the dollar of the United States of America (symbol $, code USD), and the Swiss franc of Switzerland (code CHF). The pair’s exchange rate indicates how many Swiss francs are needed in order to purchase one US dollar. For example, when the USD/CHF is trading at 1.2500, it means 1 US dollar is equivalent to 1.25 Swiss francs.  The US Dollar (USD) is the world’s most traded currency, whilst the Swiss franc (CHF) is the world’s sixth most traded currency,Read this Terms tumble lower today saw the price move below a swing area between 0.9278 and 0.9290, and then below other swing areas between 0.9259 and 0.9262, and 0.92139 and 0.92191 (see yellow areas in the chart above). The low price reached 0.91768 so far. The next target comes between 0.9157 and 0.91651 (see red numbered circles in the chart above). The low price from February 13 is down at 0.91357 and would represent another target on further selling. What would hurt the bearish bias for the USDCHF? A move back above 0.92139 and 0.92191 would be a chink in the short term intraday bias. Additionally a move back above the 38.2% – 50% retracement of the trend move down from the high at 0.93159 would be indicative of a weaker trend bias. That area comes between 0.9229 and 0.9246. Typically, a trend like move like seen in the USDCHF, can see corrective moves into the 38.2 -50% level and still keep a trend bias.  As a result, traders will look toward that corrective zone for selling opportunities in the short term. On Wednesday, the price of the  USDCHF was testing the swing highs going back to December 2022.. Since then the price has moved down some 260 pips. GBPUSD: The GBPUSDs initial move to the upside today found willing sellers against the Topside downward sloping trendline. The subsequent move to the downside however, found support buyers against its 100 daymoving averageMoving averageA moving average is a statistical tool that is used to smooth out short-term fluctuations in data and reveal longer-term trends. It is calculated by taking the average of a certain number of data points over a specific period of time, and then plotting that average as a line on a chart. The most common types of moving averages are simple moving averages (SMA) and exponential moving averages (EMA).In financial markets, moving averages are often used to analyze stock prices, exchange rates, and otA moving average is a statistical tool that is used to smooth out short-term fluctuations in data and reveal longer-term trends. It is calculated by taking the average of a certain number of data points over a specific period of time, and then plotting that average as a line on a chart. The most common types of moving averages are simple moving averages (SMA) and exponential moving averages (EMA).In financial markets, moving averages are often used to analyze stock prices, exchange rates, and otRead this Termat 1.2009 (blue line step line in the chart above). That moving average held resistance earlier in the European session as well. The inability to move back below the 100 day moving average, gave the buyers the go-ahead to push higher. Once the price was able to get above the trend line and above the 1.20497 level (see red numbered circles), the buying intensified and the price moved up to a high of 1.2110. Currently the price is trading right around the 61.8% retracement, and the swing high from March 1 near 1.2091. A move below that level would have traders looking toward the swing high from earlier this week at 1.20646 and then another swing area near 1.2050 (see red numbered circles). If the buyers are to remain in control, staying up above those levels (with the 1.20916 being the most bullish) are the best case scenarios for buyers in the short-term. A move back below 1.2050 with momentum would be disappointing for the buyers  in the short term and have traders scratching their heads a bit.",Negative,-0.42,200642.0,united states,47.4,50.5,69.7,0.055,0.034,0.039,0.037,0.031,dxy,103.36,104.26,100.62,101.33,2.87237,253.423,20408.1,29723.864,4.64,4.1,106.37000274658205,106.5999984741211,106.08999633789062,106.4800033569336
2024-12-04,USDJPY,Neutral,USDJPY tests 134.00 area and swing area target between 134.068 and 134.15,Greg Michalowski,https://www.forexlive.com/technical-analysis/usdjpy-tests-13400-area-and-swing-area-up-to-13415-20230310/,Forex Live,"TheUSDJPYUSD/JPYThe USD/JPY is the currency pair encompassing the dollar of the United States of America (symbol $, code USD), and the Japanese yen of Japan (symbol ¥, code JPY). The pair’s rate indicates how many Japanese yen are needed in order to purchase one US dollar. For example, when the USD/JPY is trading at 100.00, it means 1 US dollar is equivalent to 100 Japanese yen.  The US dollar (USD) is the world’s most traded currency, whilst the Japanese yen is the world’s third most traded currency, resultingThe USD/JPY is the currency pair encompassing the dollar of the United States of America (symbol $, code USD), and the Japanese yen of Japan (symbol ¥, code JPY). The pair’s rate indicates how many Japanese yen are needed in order to purchase one US dollar. For example, when the USD/JPY is trading at 100.00, it means 1 US dollar is equivalent to 100 Japanese yen.  The US dollar (USD) is the world’s most traded currency, whilst the Japanese yen is the world’s third most traded currency, resultingRead this Termhas just reached a low of 134.104. That is getting closer to the natural support at 134.00. It is also within a swing area (see red numbered circles) between 134.068 and 134.15. That area was defined by swing levels going back to February 20, 21 and 24 (before basing and moving higher on that February 24). In addition, the 38.2% retracement of the move up from the February low to the high price reached just on Wednesday comes in at 134.151. The combination of that cluster of technical levels is leading to a pretty quick bounce up to the 134.40 currently. Support buyers are either taking profit from shorts against the level, or sticking a toe in the water. In the morning technical report (review below), I outlined the swing area between 135.11 and 135.22 (see blue numbered circles) as being a key level going forward. That level was broken and led to a run to the downside. It will now be a ceiling for the pair if the sellers are to remain more in control going forward. Be aware.",Neutral,0.01,240244.0,united states,47.4,50.5,69.7,0.055,0.034,0.039,0.037,0.031,dxy,103.36,104.26,100.62,101.33,2.87237,253.423,20408.1,29723.864,4.59,4.1,106.33999633789062,106.72000122070312,106.08999633789062,106.43000030517578
2024-12-05,GBPUSD,Neutral,GBPUSD Price Analysis Climbs on USD weakness but fails to conquer the 200DMA,Christian Borjon Valencia,https://www.fxstreet.com/news/gbp-usd-price-analysis-climbs-on-usd-weakness-but-fails-to-conquer-the-200-dma-202303101842,FX Street,"GBP/USD recovers some ground getting ready to finish the week with minimal gains after bouncing off YTD lows at 1.1802, with buyers reclaiming 1.2000 on a mixed USjobs report. At the time of writing, the GBP/USD is trading at 1.2040, above its opening price y 1.01%. GBP/USD Price Action The GBP/USD has reclaimed the 1.2000 figure, but its bias has not changed. The aftermath of the US Nonfarm Payrolls report witnessed the Pound Sterling (GBP) reaching the 200-day Exponential Moving Average (EMA) at 1.2112. However, sellers stepped in and dragged the spot beneath the 1.2100 mark. On its way south, the GBP/USD pierced under the 50-day EMA, leaving the exchangeratesaround familiar levels. Nevertheless, the 100 and 20-day EMAs are resting below the current prices, warranting further consolidation ahead. For a bearish resumption, the GBP/USD needs to crack the 100 and 20-day EMAs, each at 1.2023 and 1.2010, respectively. After that, the 1,2000 figure could be grabbed, paving the way for further downside. The following support would be the 1.1900 figure, ahead of the YTD low at 1.1802. Conversely, theGBP/USDmust reclaim the 50-day EMA at 1.2056 if buyers want to remain hopeful of shifting the trend. The next resistance would be 1.2100, followed by the 200-day EMA at 1.2112. GBP/USD Daily Chart  GBP/USD Technical Levels GBP/USD  ",Negative,-0.22,215135.0,united states,47.4,50.5,69.7,0.055,0.034,0.039,0.037,0.031,dxy,103.36,104.26,100.62,101.33,2.87237,253.423,20408.1,29723.864,4.59,4.1,105.70999908447266,106.37000274658205,105.6999969482422,106.33999633789062
2024-12-06,USDJPY,Neutral,Forex Today DXY ends week flat after Powell and NFP ahead of US CPI Wall Street plunges,Matías Salord,https://www.fxstreet.com/news/forex-today-dxy-ends-week-flat-after-powell-and-nfp-ahead-of-us-cpi-wall-street-plunges-202303101914,FX Street,"What you need to take care next week: The US Dollar dropped sharply on Friday after the US employment report. The DXY erased all the gains that followed Federal Reserve Jerome Powell's hawkish remarks. The US economy added morejobsthan forecast in February (311K vs 205K) and confirmed the shocking numbers of January. However, theUnemployment Raterose to 4.6% and wage growth slowed down. Before NFP, expectations about a 50 basis points rate hike at the next FOMC meeting were elevated and then pulled back, pushing US yields to the downside. Treasury bonds also rose amid risk aversion. The VIX (Fear index) jumped on Friday to 27.42, a level not seen since late October. US stock indices added to losses on Friday, ending the week with a decline of more than 4%. Next week will be quiet on Fed talk as FOMC enters the blackout period. It will be time for rumours and speculations ahead of the March 21-22 meeting. Analysts differ in their forecast, some going for a 25 bps hike and others for 50 bps. The key economic report that could end the debate will be on Tuesday with the US Consumer Price Index. Those numbers would be critical for the consideration of the Fed's rate hike. More inflation numbers are due on Wednesday with the Produce Price Index; also Retail Sales will be reported the same day. DXYpeaked near 106.00, the highest since November and then dropped all the way back to 104.50. The US 2-year Treasury yield rose to the highest since 2007 at 5.08%, falling on Friday to 4.58%, the lowest in three weeks. Despite DXY's reversal, the Dollar held onto weekly gains versus emerging market and commodity currencies. USD/JPYdropped for the second week in a row after being unable to consolidate above 137.00 hit by lower bond yields and the sell-off in Wall Street. At Kuroda's last meeting, the Bank of Japan kept its policy rate, the Yield Curve Control parameters and guidance unchanged. Among the week's top performers was the Swiss Franc boosted by risk aversion, lower yields and Swiss inflation data.USD/CHFsuffered the worst weekly loss since November. The Australian Dollar was the biggest loser on G10 space affecter after the Reserve Bank of Australia's dovish rate hike. Next Thursday, Australia will report employment numbers.AUD/USDbroke the key 0.6600 support area and plunged to the weakest since November. One of the best of the week was sellingAUD/CHFafter the RBA meeting. USD/CADgained over 200 pips over the week, posting above 1.3800, the second-highest weekly close since May 2020. On Wednesday, the Bank of Canada left rates unchanged (as expected) after eight consecutive hikes and said it will stay on ""a conditional pause"". The Canadian economy added 21.8K jobs in February, above the 10K expected. EUR/USDerased weekly losses rising back toward 1.0650 on Friday. The pair continues to move sideways between 1.0530 and 1.0700. Next Thursday, theEuropean Central Bankis expected to hike interest rates by 50 basis points. Some debate is emerging at the board about its forward guidance. EUR/GBP is still clinging to the 0.8850 area. GBP/USD rebounded from 1.1800, peaked at 1.2115, to settle around 1.2040. UK employment data is due on Tuesday.",Negative,-0.93,266506.0,united states,47.4,50.5,69.7,0.055,0.034,0.039,0.037,0.031,dxy,103.36,104.26,100.62,101.33,2.87237,253.423,20408.1,29723.864,4.6,4.1,105.97000122070312,106.16000366210938,105.41999816894533,105.79000091552734
